Question,Topic,Subtopic,Option 1,Option 2,Option 3,Option 4,Correct Answer
"MLO Thomas received a loan application from Vince. When he read the property address for the house Vince was buying, he saw that it was his brother's house. His brother was recently offered a job in another town and was anxious to ensure that the sales transaction wouldn't fall through for any reason. Ethically, what must Thomas do in this situation?",Ethics,Ethical Behavior Related to Loan Origination Activities,"Because his brother is anxious to sell, Thomas should create documentation to support the buyer's loan application.","Since Thomas has a personal interest in the transaction, he must disclose it.",Thomas should ask the underwriter as a personal favor to go easy on the buyer's application.,Thomas should share details with his brother about what he learns from the buyer's credit history.,1
The NMLS will look at all of the following information EXCEPT for which item when an individual applies for MLO licensure?,Uniform State Content,License Law and Regulation,Credit card bills,Outstanding judgments,Outstanding tax liens,Previous foreclosures,0
"An MLO has an established business relationship with a consumer who only submitted a loan application and who's on the Do Not Call Registry. Related to solicitation calls, which of the following statements is true?",Ethics,Ethical Issues,The consumer may be called for up to 18 months.,The consumer may be called for up to 90 days.,The consumer may be called without restriction.,The consumer may not be called.,1
What is the purpose of the Maryland Fair Credit Reporting Act for mortgage lending?,Uniform State Content,SAFE Act,To ensure accurate credit reporting and allow borrowers to dispute inaccuracies.,To mandate regular updates of credit scores to keep borrowers informed.,To regulate the fees that lenders impose for providing credit reports.,To require lenders to offer pre-approval to all applicants.,0
A lender has an affiliated business arrangement with a title company to which it refers its borrowers. When must the lender provide consumers with an Affiliated Business Arrangement disclosure?,Federal Mortgage-Related Laws,Real Estate Settlement Procedures Act (RESPA),At the time of loan application or referral,Immediately after loan consummation occurs,Three business days before loan consummation,Upon written request from the consumer,0
An MLO's NMLS UI must be displayed on all of the following EXCEPT for which one?,Uniform State Content,Compliance,Business cards,Loan advertisements,Loan application forms,Personal correspondence,3
"A borrower's monthly mortgage payment is $580.23. If the taxes are $83.33 each month and the insurance is $41.66 per month, how much of the monthly payment is principal plus interest?",Mortgage Loan Origination Activities,Financial Calculations,$454.34 ,$455.24 ,$465.24 ,$466.34 ,1
Your borrowers are about to close on their first home. What will protect them from financial loss if their ownership later comes into question?,Mortgage Loan Origination Activities,Qualification: Processing and Underwriting,Abstract of title,Chain of title,Title insurance,Title search,2
Which entity sets the requirements for qualified mortgages?,General Mortgage Knowledge,Terms Used in the Mortgage Industry,Consumer Financial Protection Bureau,Federal Home Loan Bank,Federal Housing Finance Agency,U.S. Congress,0
Which of these features means that a mortgage is nonqualified?,General Mortgage Knowledge,Qualified and Non-Qualified Mortgage Programs,It's less risky to the lender than a qualified mortgage.,It's the borrower's second mortgage.,The borrower's income can't be verified.,The loan term is less than 30 years.,2
Which of the following items might appear on the title commitment as a condition that must be satisfied?,Mortgage Loan Origination Activities,Closing,Disclosure of closing fees and costs,Payment of moving expenses,Payment of prior liens,Review of prorated payments to be made by buyer and seller,2
"Gabriela has sent a GFE to an applicant for a loan. She has learned that the applicant received the GFE today, but she has had no further communication with him. Is Gabriela allowed to charge the applicant a fee for an appraisal? Why or why not?",Federal Mortgage-Related Laws,Real Estate Settlement Procedures Act (RESPA),No. Extra fees may not be charged until the applicant has had three business days to review the GFE.,No. The applicant has not yet indicated that he wants to proceed with the loan.,Yes. Gabriela has been able to confirm that the loan applicant received the GFE.,"Yes. In fact, Gabriela didn't even have to wait until the applicant received the GFE.",1
Which of the following is true regarding the Home Mortgage Disclosure Act?,Federal Mortgage-Related Laws,Other Federal Laws and Guidelines,It keeps all loan applicant information secure and completely private.,"It only pertains to information about loans and lenders, not loan applicants.",It prohibits discriminatory lending.,It requires financial institutions to report demographic information about loan applicants.,3
Which one of the following options accurately reflects acceptable fees for the escrow account according to federal regulations?,Mortgage Loan Origination Activities,Closing,A servicer isn't permitted to charge fees for escrow accounts.,A servicer is permitted to use an escrow account to hold funds due at closing and all future property expenses agreed upon by both parties. The permitted fees include 1/12 of the annual costs paid from escrow and one-sixth of the fees due as a cushion.,A servicer is permitted to use an escrow account to hold funds due at closing and all future property taxes and homeowners insurance. The permitted fees include 1/12 of the annual costs paid from escrow and one-sixth of the fees due as a cushion.,A servicer is restricted to using an escrow account to hold funds due at closing and during the fiscal year of closing. The only permitted fees are one-sixth of the fees due at closing.,1
Which one of the following statements is true about escrow account requirements?,General Mortgage Knowledge,Terms Used in the Mortgage Industry,A borrower may choose to not have an escrow account.,Escrow accounts are maintained by the borrower after closing.,Escrow accounts are mandatory for all mortgage loans.,The lender determines if an escrow account must be established and maintained.,3
How may an MLO ensure compliance with all consumer protection laws governing his advertising?,Ethics,Ethical Issues,Hire the best advertising agency in town to handle all advertisements.,Implement an advertising review plan before his advertisements are published.,Request that the most senior person in the company develop all his ads.,Revise his advertisements based on consumer feedback.,1
How can an adjustable-rate mortgage best be described?,General Mortgage Knowledge,Terms Used in the Mortgage Industry,"A fixed-rate loan with a lower interest rate than most loans, usually for a 15- or 30-year term",A loan obtainable by a borrower who has a lower credit score or who does not have a 20% down payment,A loan with an interest rate that adjusts based on current market rates,A temporary loan in which a borrower can tap into existing equity to use as a down payment on a new home,2
Which of the following lists characteristics that may be used by lenders when evaluating a loan application?,Federal Mortgage-Related Laws,Equal Credit Opportunity Act (ECOA),"Age, income, and net worth","Ethnicity, job stability, and credit rating","Income, net worth, job stability, and credit rating","Race, income, and job stability",2
"Qualified mortgages have a limit on upfront points and fees. Assuming a loan amount of $50,000, the points can't exceed ______ of the total loan amount.",General Mortgage Knowledge,Terms Used in the Mortgage Industry,2%,3%,4%,5%,3
Which of the following types of loans are covered by TILA and Regulation Z?,Federal Mortgage-Related Laws,Truth in Lending Act (TILA),Agricultural loans,Commercial loans,Loans to acquire rental property,Reverse mortgages,3
What method may be used to provide a Loan Estimate to a consumer?,Mortgage Loan Origination Activities,Qualification: Processing and Underwriting,All of these formats,Mail,Telephone,Text message,1
"A borrower was obtaining a conventional loan, and she put $50,000 down as a down payment. Why might her lender also require her to obtain private mortgage insurance?",General Mortgage Knowledge,Terms Used in the Mortgage Industry,"Her down payment of $50,000 isn't at least 20% of the purchase price.",Her lender is a subprime lender.,"PMI is triggered at the $50,000 down payment amount.",She has poor credit.,0
Which one of the following statements regarding HOEPA loans is true?,Federal Mortgage-Related Laws,Truth in Lending Act (TILA),HOEPA doesn't include any disclosure requirements.,HOEPA is designed to protect lenders from borrowers who have poor credit histories.,"If a loan meets the HOEPA criteria, the lender must give the borrower several disclosures at least three business days before closing on the loan.",Mortgages secured by a vacation home are subject to HOEPA coverage.,2
"You provided a LE to your borrowers, listing $1,000 as the property tax amount they'll be expected to pay. When they receive the CD from you, the amount was $1,500. Why is that legal?",Mortgage Loan Origination Activities,Qualification: Processing and Underwriting,Only a 10% increase is allowed.,"Property taxes cannot exceed $1,000.",Property tax is a no or unlimited tolerance threshold.,Property tax may not have any kind of fee increase.,2
What's the purpose of the Loan Estimate being provided to prospective borrowers?,Federal Mortgage-Related Laws,Truth in Lending Act (TILA),The disclosure allows them to make uninformed decisions about a loan's terms.,The disclosure helps them make informed decisions about a loan's affordability.,"The disclosure locks in a loan's interest rate, payments, and other terms.",The disclosure prepares them for homeownership by testing their knowledge.,1
You are working with your borrowers on a pre-approval letter. Which of these items is something you will NOT request?,Mortgage Loan Origination Activities,Loan Inquiry and Application Process Requirements,Driver's license,Recent bank account statements,The exact amount of their loan,The last two years of income tax,2
Which one of these borrowers qualifies for an FHA reverse mortgage?,General Mortgage Knowledge,Terms Used in the Mortgage Industry,A borrower who is 27 and refinancing her first mortgage,A borrower who is over the age of 62,A borrower with a credit score below 580,A first-time homebuyer who is 23,1
"Which disclosure summarizes all account payments and deposits during the year, as well as any deficits or surpluses in an escrow account?",Federal Mortgage-Related Laws,TILA-RESPA Integrated Disclosure Rule (TRID),Annual escrow statement,Escrow closing notice,Initial escrow statement,Mortgage servicing transfer statement,0
What does a preliminary title report reveal?,Mortgage Loan Origination Activities,Qualification: Processing and Underwriting,"Both the property's ownership and any liens, encumbrances, or circumstances that won't be covered under a title policy","Liens, encumbrances, or circumstances that won't be covered under a title policy",Prior encumbrances that no longer exist,The property's ownership,0
Which document is used to establish proof of ownership and to transfer the title?,Mortgage Loan Origination Activities,Closing,Abstract of title,Deed,Survey,Title insurance policy,1
Under what condition is a VA loan assumable?,Uniform State Content,Compliance,No restrictions apply to an assumption of a VA loan.,The loan is assumable with VA approval (if it were made after 1988).,VA loans are assumable only by other veterans.,VA loans are not assumable.,1
How may an MLO ensure compliance with all advertising laws when developing advertisements?,Uniform State Content,Compliance,Hire a highly rated advertising agency to create the advertisements.,Implement an advertising review plan before publishing the advertisements.,Request that the most senior person in the company develops all his ads.,Revise the advertisements based on negative consumer feedback.,1
"A loan applicant purchased a property a year ago but stated she's buying the fixer-upper property next door and will live in it full-time. If the MLO suspects fraud, what type of fraud is this?",Ethics,Ethical Issues,Asset fraud,Income fraud,Liability fraud,Occupancy fraud,3
What is HUD's mission?,Federal Mortgage-Related Laws,Regulatory Authority,"To create strong, sustainable, inclusive communities and quality affordable homes for all",To enforce the law of the land in support of the American dream,"To ensure that every citizen, regardless of race, religion, sex, or familial status, owns a home","To provide safe, affordable housing in American suburbs",0
What type of loan meets the acceptable criteria for purchase by Fannie Mae and Freddie Mac?,General Mortgage Knowledge,Qualified and Non-Qualified Mortgage Programs,Conforming loan,Government loan,Jumbo loan,Nonconforming loan,0
Creditors must retain completed CD forms for at least ______ years from the date of completion.,Uniform State Content,Compliance,Five,Nine,Seven,Three,0
"A borrower takes out a loan for $90,000. He estimates that he will pay $525 per month toward interest for the first year of the loan. What is the interest rate for the loan?",Mortgage Loan Origination Activities,Financial Calculations,0.58%,14.30%,171%,7%,3
"What allows federal and state regulators to track mortgage providers, even across state lines?",Uniform State Content,State Mortgage Regulatory Agencies,An NMLS UI,A Social Security number,A tax ID number,A tracking device,0
"A borrower pays $38,000 as a down payment on a home valued at $305,000. What percent down has the borrower paid?",Mortgage Loan Origination Activities,Financial Calculations,11.10%,12.40%,14.20%,8%,1
"Along with knowing not to steal, borrow, or commingle escrow funds, mortgage licensees need to understand specific state rules, particularly ______.",Uniform State Content,License Law and Regulation,"How escrow funds are received, held, and disbursed",How to hire someone to keep track of escrow funds,Their role in disbursing funds,When it is acceptable to spend escrow funds on personal expenses,0
"Your borrower is worried that after closing, someone else can claim ownership of the property. What can reassure her?",Mortgage Loan Origination Activities,Qualification: Processing and Underwriting,Abstract of title,Chain of title,Title insurance,Title search,2
"If a mortgage lender approves a loan application, the approval can be verbal or written. If the lender denies the loan application, the lender must provide ______.",Federal Mortgage-Related Laws,Equal Credit Opportunity Act (ECOA),An adverse action notice within 60 days,An email notification of the decision within 10 days,A verbal adverse action notice,A written adverse action notice,3
"The _______ is a federal agency that works to implement goals to ensure affordable housing, protect consumers, and build inclusive communities in the U.S.",Federal Mortgage-Related Laws,Regulatory Authority,Department of Commerce,Department of Health and Human Services,Department of Homeland Security,Department of Housing and Urban Development,3
A borrower is completing a residential loan application. Which of the following would he include in the liabilities section?,Mortgage Loan Origination Activities,Qualification: Processing and Underwriting,Amount on deposit at his bank,Car loan,House,Stock holdings,1
Which of the following best defines an annual percentage rate (APR)?,Federal Mortgage-Related Laws,Truth in Lending Act (TILA),A standardized measure for interest rates and other costs of the loan,"Fees charged by a lender, expressed as a percentage",The amount a borrower pays in interest for a single year,The amount a lender can collect in interest from a borrower during a single year,0
How long does a mortgage servicer have to refund escrow funds to the borrower?,Mortgage Loan Origination Activities,Closing,15 business days,15 calendar days,20 business days,30 business days,2
Which one of the following is information that licensees are NOT required to change with the NMLS?,Uniform State Content,License Law and Regulation,Change of address,Change of legal status,Name change,Personal credit change,3
The USA PATRIOT Act expanded the scope and requirements of which other federal law?,Federal Mortgage-Related Laws,Other Federal Laws and Guidelines,The Bank Secrecy Act,The Dodd-Frank Act,The Gramm-Leach-Bliley Act,The Truth in Lending Act,0
Revised LEs may be provided to borrowers when there is a valid ______.,Federal Mortgage-Related Laws,TILA-RESPA Integrated Disclosure Rule (TRID),Business reason,Changed circumstance,Credit history,Market fluctuation,1
"Andy ran an advertisement that misrepresented the interest, payments, or other terms with inaccurate usage of “fixed” to describe them. This is misrepresentation of the ______ of the terms.",Ethics,Ethical Issues,Additional product name,Default potential,Mortgage product type,Variability,3
Which of the following types of data is NOT included in public data collected under HMDA?,Federal Mortgage-Related Laws,Other Federal Laws and Guidelines,Amounts and types of loans that have been granted,Identifying information about individuals who have received loans,Mortgage applications that have been approved or denied,The purposes of loans that have been granted,1
Which of the following is a true statement regarding RESPA and the foreclosure process?,Federal Mortgage-Related Laws,Real Estate Settlement Procedures Act (RESPA),A lender has five days after receiving a loss mitigation application to acknowledge receipt and request any additional information.,"Borrowers may only apply for a loan workout if they are delinquent on a loan, but not once the loan is in default.","If a borrower defaults on a loan and fails to file a loss mitigation application, the lender may immediately begin foreclosure proceedings.","Once borrowers submit a loss mitigation application, they must accept the new terms offered by the servicer.",0
An MLO is seeking licensure in a different state and has applied for temporary authority. The state denies the application. What most likely happened?,Uniform State Content,License Law and Regulation,A state-licensed mortgage company employs him in the state where he applied.,He experienced a disqualifying event.,He was registered as an MLO for one year preceding the application submission.,He was registered for 30 days preceding the application date.,1
"A borrower is completing a residential loan application. On the application, he lists his assets. What are assets?",Mortgage Loan Origination Activities,Qualification: Processing and Underwriting,Items of value the borrower owns,Obligations the borrower owes,The difference between a borrower's items of value and obligations,Wages earned from employment,0
Seller Ryan's property has a lien on it. A lien is _____.,General Mortgage Knowledge,Terms Used in the Mortgage Industry,"A legal claim on a property, meaning that the owner of the lien has rights to the property if the loan or obligation is not satisfied",A title that establishes the priority of the deed,A type of mortgage,The legal device used in securing the property,0
The fully indexed rate for an adjustable-rate mortgage is 4.5%. The loan had a start rate of 3.2% and a margin of 2.1%. What was the index value at the time the initial rate adjustment took effect?,Mortgage Loan Origination Activities,Financial Calculations,1.30%,2.40%,5.30%,6.60%,1
In which of the following instances is an MLO considered to have steered a consumer into a loan?,Ethics,Ethical Issues,The consummated transaction is in the consumer's interest.,The consummated transaction is in the originator's interest.,The originator makes a consistently high income.,The originator makes more high-cost loans than other MLOs.,1
MLO applicants must permit a credit report to be pulled so states can evaluate whether the applicant demonstrates ______.,Uniform State Content,License Law and Regulation,A criminal history,A lengthy credit history,A low debt-to-income ratio,Financial responsibility,3
The NMLS serves ______.,Uniform State Content,State Mortgage Regulatory Agencies,All 50 states and U.S. territories,Only the 50 states,The eastern part of the United States,The western part of the United States,0
The Dodd-Frank Act created the CFPB to ______.,Federal Mortgage-Related Laws,Regulatory Authority,Create a financial watchdog committee,Promote transparency for mortgages and other financial products,Reduce regulation and oversight of the financial services industry,Require a physical property visit for certain higher-cost mortgages,1
Which one of the following parties dictates whether the borrower may shop for a closing agent in a real estate loan transaction?,Mortgage Loan Origination Activities,Closing,The appraiser,The lender,The mortgage loan originator,The real estate agent,1
What does RESPA prohibit to protect borrowers from overcharges in a mortgage loan closing?,Ethics,Ethical Issues,Closing costs,Disclosure,Kickbacks,Origination fee,2
All of the following are possible penalties that the CFPB may impose EXCEPT for which one?,Uniform State Content,Compliance,"Fine a violator as much as $34,401 per offense.",Impose jail time.,Issue a cease-and-desist order.,Suspend a license.,1
A borrower applies for an adjustable-rate mortgage with a start rate of 2.6% and a margin of 1.9%. The index used was at 2.9% at the time of the initial rate adjustment. What is the fully indexed rate?,Mortgage Loan Origination Activities,Financial Calculations,2.90%,4.50%,4.80%,5.50%,2
"Under the ECOA, a lender may legally ask about a consumer's ______ in order to make a credit decision.",Federal Mortgage-Related Laws,Equal Credit Opportunity Act (ECOA),Marital status,Payment history,Race,Receipt of public assistance,1
A borrower applied for a home equity line of credit from their federally insured bank so that they could make some renovations to their kitchen. The same bank holds the note on the borrower's home mortgage. Will the HELOC be subject to RESPA requirements?,Federal Mortgage-Related Laws,Real Estate Settlement Procedures Act (RESPA),"No, because the borrower won't be using a real estate professional.","No, because there's no transfer of title involved.","Yes, because RESPA applies to any residential loan transaction from a federally insured financial institution, including home equity lines of credit.","Yes, because the bank is also the lender for his home mortgage. If they'd used a different lender, RESPA would not apply.",2
Which document is used to establish the path and proof of ownership?,Mortgage Loan Origination Activities,Closing,Chain of title,Deed,Survey,Title,0
Which of the following factors would be considered a serious derogatory credit reference?,Mortgage Loan Origination Activities,Qualification: Processing and Underwriting,"Your client co-signed on his son's loan, which is currently paid off.",Your client has a paid-off collections account from four years ago.,Your client was 30 days late on a credit card payment 12 months ago.,Your client was 60 days late on his mortgage seven months ago.,3
How many days after consummation does a creditor have to refund a borrower for a tolerance correction?,Mortgage Loan Origination Activities,Qualification: Processing and Underwriting,15 days,30 days,45 days,60 days,3
Regulation N provides 19 examples of the ______ that were the subject of enforcement actions before its adoption.,Ethics,Ethical Issues,Least common advertising misrepresentations,Most common advertising misrepresentations,Violator lenders,Violator MLOs,1
"MLO Maggie asked her teammate Ken to review her first closing statement. The amount of prepaid mortgage insurance, taxes, and interest appear to be correct. In addition to itemizing what the borrower-paid closing costs are, he should also verify the prepaid section includes ______ for accuracy.",Mortgage Loan Origination Activities,Closing,The applicable time period,The estimated monthly cost,The initial escrow payment due,When the next payment for each item is due,0
What is the purpose of PMI?,Federal Mortgage-Related Laws,Other Federal Laws and Guidelines,"Insure the dwelling in the case of fire, flood, or other natural disasters.",Prevent the lender from having to provide the property insurance itself.,Protect the borrower from being defrauded.,Protect the lender in case of borrower default.,3
Which federal agency is responsible for administering the Home Mortgage Disclosure Act (HMDA)?,Federal Mortgage-Related Laws,Other Federal Laws and Guidelines,Consumer Financial Protection Bureau,Department of Commerce,Federal Trade Commission,U.S. Department of Housing and Urban Development,0
A settlement service is ______.,Federal Mortgage-Related Laws,Real Estate Settlement Procedures Act (RESPA),Any service provided for a prospective or actual settlement,Any service provided to a settlement service provider before closing,Only a service provided as a result of an actual settlement,When an MLO handles closing services,0
"According to TILA, residences on land the unit owner is leasing or renting are considered ______.",Federal Mortgage-Related Laws,Truth in Lending Act (TILA),Chattel,Condos,Dwellings,New construction,2
