Question,Topic,Subtopic,Option 1,Option 2,Option 3,Option 4,Correct Answer
"According to the definition of an MLO under the SAFE Act, a loan originator does not include which one of the following people?",Uniform State Content,License Law and Regulation,Administrative or clerical personnel working for an MLO,An individual who takes loan applications,A person who offers or negotiates terms of a residential mortgage loan for compensation or gain,Someone who negotiates loans for a mortgage lender,0
MLOs ______ their books and records available for a state licensing agency to access.,Uniform State Content,Compliance,Are not responsible for making,Must always make,Must never make,Must sometimes make,1
What type of insurance is a form of indemnity insurance that can protect both borrowers and their lender?,Mortgage Loan Origination Activities,Qualification: Processing and Underwriting,Collateral insurance,Hazard insurance,Mortgage insurance,Title insurance,3
Who performs closing services according to the Code of Federal Regulations?,Mortgage Loan Origination Activities,Qualification: Processing and Underwriting,Borrower's real estate agent,Closing agent,Mortgage loan originator,Seller's real estate agent,1
The CSBS and AARMR have said which one of the following is a way to mitigate the risks associated with nontraditional mortgage products?,General Mortgage Knowledge,Terms Used in the Mortgage Industry,Avoid risk management practices.,Expand loan terms.,Provide consumer communication and education opportunities.,Stop offering nontraditional mortgage products and loan features.,2
"Mac is a new loan originator. He's responding to a consumer's inquiry. In a rush, he puts his boss's UI in the email instead of his own. What has Mac done wrong?",Uniform State Content,Compliance,Omitted debt not on a credit report.,Paid for the real estate agent's ads.,Used bait-and-switch advertising.,Used his supervisor's NMLS UI.,3
State agency-regulated institutions ______ to make their loan originators comply with financial laws and regulations.,Uniform State Content,State Mortgage Regulatory Agencies,Are legally not required,Are not required,Are required,Need a lot of help,2
A borrower is applying for an FHA loan. What's the least amount the borrower should plan on paying as a down payment?,Mortgage Loan Origination Activities,Financial Calculations,20%,3%,3.50%,No down payment is required.,2
"A homebuyer purchased a house for $220,000 and financed $200,000 with a 30-year conventional mortgage at 4% interest. His monthly principal and interest payment is $955. The annual property taxes are $1,400, and the combined annual insurance premium is $900. What is the buyer's PITI payment each month?",Mortgage Loan Origination Activities,Financial Calculations,"$1,146.67 ","$1,153.67 ","$1,176.50 ","$1,364.94 ",0
What's the first step in determining loan suitability for a consumer?,Mortgage Loan Origination Activities,Qualification: Processing and Underwriting,Determine the loan(s) for which the borrower qualifies.,Determine which loan will give them the most significant net benefit.,Identify how much the borrowers will pay monthly.,It's entirely up to the customer to determine loan suitability.,0
"A telemarketer called a consumer every day for a week because, on the first call, the individual was rude and then hung up on him. How would the TSR define the telemarketer's conduct?",Ethics,Ethical Issues,Abusive,Deceptive,Disproportionate,Persuasive,0
"Using the calendar year method, what is the daily rate for an annual tax bill of $4,662?",Mortgage Loan Origination Activities,Financial Calculations,$12.77 ,$12.95 ,$155.40 ,$388.50 ,0
Gus believes he was the victim of a bait-and-switch scheme because his loan originator ______.,Uniform State Content,Compliance,Denied his loan at the last minute,Gave him the exact loan he was promised,Swapped his loan for a less appealing one,Swapped his loan for a more appealing one,2
"Per the E-Sign Act, mortgage loan disclosures and records that have been delivered and signed electronically are ______.",Federal Mortgage-Related Laws,Equal Credit Opportunity Act (ECOA),Illegal,Unenforceable,Valid and enforceable,Voidable,2
Which one of the following laws focuses on unfair high-rate loan practices?,Federal Mortgage-Related Laws,Truth in Lending Act (TILA),Fair Lending Act,Homebuyer Protection Act,Home Ownership and Equity Protection Act,Lender Protection Act,2
"When a borrower applies for a loan that will be secured by a first lien on a dwelling, what's the lender required to provide related to the property's value?",Federal Mortgage-Related Laws,Equal Credit Opportunity Act (ECOA),A boundary survey,A comparative market analysis,A copy of the appraisal,A free appraisal,2
A borrower doesn't want to provide demographic information on the loan application. What should you do?,Mortgage Loan Origination Activities,Loan Inquiry and Application Process Requirements,Complete the section based on conversations with the borrower.,Complete the section based on your visual observation of the borrower.,Leave the Demographic section blank.,Refuse to process the application.,1
Which loan disclosure form provides buyers with an approximation of the costs they're likely to pay at settlement?,Federal Mortgage-Related Laws,TILA-RESPA Integrated Disclosure Rule (TRID),Closing Disclosure,HUD-1 statement,Loan Estimate,Mortgage Servicing Transfer Disclosure,2
Who is responsible during the escrow process for distributing funds for things like the appraisal and loan fees in Arizona?,Uniform State Content,License Law and Regulation,The borrower,The escrow agent,The mortgage broker,The real estate agent,1
"Gabriela works for a lender. On Monday of this week, she received an application from someone who is looking for a loan. How long has she got to provide the applicant with a GFE?",Federal Mortgage-Related Laws,Real Estate Settlement Procedures Act (RESPA),"Until Friday, four business days later","Until the following Monday, one week later","Until Thursday, three business days later","Until Wednesday, two business days later",2
A borrower has three days to reconsider his decision and back out of the loan process. What is this time period known as?,Federal Mortgage-Related Laws,TILA-RESPA Integrated Disclosure Rule (TRID),Evaluation period,Grace period,Right of rescission,Right to reconsider,2
Which one of the following statements about title insurance is false?,Mortgage Loan Origination Activities,Qualification: Processing and Underwriting,Title insurance protects the buyer against loss resulting from previously unreported title defects.,Title insurance protects the lender against any future default in the buyer's payments.,Title insurance protects the lender from loss due to defective title.,Title insurance provides assurance that the property owner has marketable title.,1
A loan origination fee is best described as a fee that a lender charges _____.,Mortgage Loan Origination Activities,Closing,For processing a loan,For servicing a loan,For the use of its money,When a borrower pays off a loan,0
Which tolerance threshold applies to escrow accounts?,Mortgage Loan Origination Activities,Loan Inquiry and Application Process Requirements,10% tolerance,It depends on certain factors.,No or unlimited tolerance,Zero tolerance,2
"An MLO created an advertisement that stated, “Mortgage loans for applicants with all types of credit. Affordable monthly payments available.” To comply with TILA, what must this ad include related to trigger terms?",Federal Mortgage-Related Laws,Truth in Lending Act (TILA),Nothing more is required.,The annual percentage rate for loans,The required monthly payment amount,The total number of payments required,0
Which type of home loan did Deferred Action for Childhood Arrivals (DACA) recipients recently become eligible for?,Federal Mortgage-Related Laws,Other Federal Laws and Guidelines,Federal Housing Administration (FHA) loans,Jumbo loans,U.S. Department of Agriculture (USDA) loans,U.S. Department of Veterans Affairs (VA) loans,0
______ is the federal entity that regulates MLO activity.,Uniform State Content,Compliance,The Capital Freestanding Policing Division,The Client Financial Protection Bulletin,The Consumer Financial Protection Bureau,The Customer Functional Processing Department,2
What form assures the title company and the buyer that the seller has not introduced new title defects and has revealed any non-publicly known title defects?,Mortgage Loan Origination Activities,Closing,Affidavit and Agreement,Affidavit of Clear Title,Affidavit of Liens,Liens and Encumbrances Declaration,0
"In calculating PITI for a mortgage payment, the annual taxes and insurance are divided by ______ and are added to the monthly principal and interest payment to make up the total monthly payment.",Mortgage Loan Origination Activities,Financial Calculations,10,12,4,6,1
"Billie responded to an advertisement about refinancing her mortgage loan because she thought it was a special government program, as indicated by the ad. She learned that a private lender, not the government, refinanced her loan. This misrepresentation was related to ______.",Federal Mortgage-Related Laws,Other Federal Laws and Guidelines,Ability to refinance or modify,Debt reduction,Default potential,Product association,3
Which one of the following is NOT the applicable loan type that requires use of the HUD-1 form?,Mortgage Loan Origination Activities,Closing,A buyer who's never purchased a home and has exceptional credit,A homeowner looking to obtain a line of credit using his property to secure the loan,A homeowner who is looking to secure a better interest rate than the current mortgage interest rate,A homeowner who needs cash and borrows money against equity in the home,0
"A borrower's monthly mortgage payment is $1,256.28. His annual property taxes are $809, and his annual insurance premium is $712. How much of his payment goes toward the principal and interest?",Mortgage Loan Origination Activities,Financial Calculations,"$1,126.75 ","$1,129.53 ","$1,256.28 ","$1,521.56 ",1
Which Gramm-Leach-Bliley Act rule requires financial institutions to disclose policies and practices to consumers regarding information use and sharing and permit them to opt out.,Federal Mortgage-Related Laws,Other Federal Laws and Guidelines,The Privacy Rule,The Red Flags Rule,The Safeguards Rule,The Sensitive Data Rule,0
"If an applicant for an MLO license has been convicted of a felony involving forgery, fraud, or a similar crime, what does that mean for the license application?",Uniform State Content,License Law and Regulation,"Additional requirements will be placed upon the applicant, including things like community service and additional background checks.","Nothing. Felony convictions, if reported with the application, do not affect the applicant's eligibility.",The applicant will never be eligible for licensure.,The applicant will not be eligible for licensure for only the seven years following the felony conviction.,2
An individual is in the process of becoming a licensed MLO and registering with the NMLS. The information he files will ______.,Uniform State Content,SAFE Act,Be available on request if approved by the state's governor,Become available via public record,Be held confidential and not accessible to anyone,Be placed in the local newspaper,1
An MLO was issued a UI by the NMLS. He decides the number is unlucky for him so he requests a new number from the NMLS. How long will it take for a new UI be issued?,Uniform State Content,State Mortgage Regulatory Agencies,"After generating $100,000 in loans, a new UI will be assigned.",He can switch his UI with someone only conducting business in his state.,"Once assigned, the UI cannot be changed.",The NMLS will assign him a new UI within 30 days.,2
"Becka received the CD on August 2, and consummation took place on August 5. On August 22, the creditor spotted a non-numeric clerical error in the disclosure. How long does the creditor have to send out corrected disclosures?",Federal Mortgage-Related Laws,Truth in Lending Act (TILA),"Until October 21, or 60 days after the error was detected","Until October 4, or 60 days after consummation","Until September 21, or 30 days after the error was detected","Until September 4, or 30 days after consummation",1
A non-U.S. citizen who has received refugee status may apply for a mortgage after securing which document or documents?,Federal Mortgage-Related Laws,Other Federal Laws and Guidelines,An official employment authorization document and residency verification only,Form I-94 only,"Form I-94, or an official employment authorization document and residency verification",Non-citizens with refugee status aren't eligible for mortgage loans.,2
A borrower may be reimbursed by the lender for closing agent fees in which one of the following scenarios?,Mortgage Loan Origination Activities,Closing,A borrower chooses a settlement agent on the written list of providers.,A borrower chooses a settlement agent who's not on the written list of providers but was recommended by a friend.,A borrower is permitted to shop for the agent.,The settlement agent is chosen by the lender.,3
"Implying or expressly stating that a communication is from the consumer's current mortgage lender when it's not, is a misrepresentation called ______.",Ethics,Ethical Issues,Additional product term,Commercial communication,Communication source,Mortgage product type,2
How must borrower Brenda provide her consent to receive electronic documents and utilize e-signatures?,Federal Mortgage-Related Laws,Equal Credit Opportunity Act (ECOA),Consumers don't need to consent to receive electronic documents.,Electronically,In writing,On a notarized form,1
Sara works in the mortgage industry. She's assembling and processing loan application paperwork before it goes for review and approval. What's her role?,Uniform State Content,License Law and Regulation,A loan processor,An MLO,An underwriter,Part of the clerical staff,0
What can loan originators use to automate and manage loan application information?,General Mortgage Knowledge,Qualified and Non-Qualified Mortgage Programs,An all-in-one automated loan origination program,Google G Suite,The NMLS website,Voice and SMS broadcasting,0
What is the top debt-to-income ratio limit for qualified mortgages?,General Mortgage Knowledge,Terms Used in the Mortgage Industry,35%,38%,43%,52%,2
Which one of the following questions are creditors prohibited from asking?,Federal Mortgage-Related Laws,Equal Credit Opportunity Act (ECOA),“What's the amount of alimony you receive?”,“What's your annual salary?”,“What's your place of employment?”,“What's your religious affiliation?”,3
"Under Maryland law, what must a lender disclose if they decide to deny a credit application based on information from a credit report?",Uniform State Content,SAFE Act,The lender must give a written notice explaining the denial and include the name and address of the credit reporting agency.,The lender must offer a chance to renegotiate the loan terms.,The lender must provide a detailed explanation of the loan terms.,The lender must send a copy of the loan agreement with the notice.,0
Which of the following is NOT a consumer protection resource for making complaints related to mortgages?,Ethics,Ethical Behavior Related to Loan Origination Activities,Better Business Bureau,Consumer Financial Protection Bureau,National Association of REALTORS®,NMLS Consumer Access site,2
How many days must an applicant wait between failed attempts on the test to retake the test?,Uniform State Content,License Law and Regulation,15 days,20 days,30 days,45 days,2
What is the purpose of a preliminary title report?,Mortgage Loan Origination Activities,Qualification: Processing and Underwriting,Documents the title's legal description to be used in the contract.,Identifies all title issues that cloud the title.,Offers to issue a title insurance policy.,Serves as a promise from the seller to the borrower that the property title is clear.,2
Which statement related to identity theft and mortgage fraud is true?,Federal Mortgage-Related Laws,Other Federal Laws and Guidelines,Identity theft is impossible to detect when used to obtain a mortgage loan.,"Identity theft is only used to obtain credit cards, not mortgage loans.",Loan applications have safeguards so that fraudulent identities can't be used.,Mortgage fraud may involve identity theft and fraudulent loan applications.,3
"According to the HPA, at what percentage of equity position does private mortgage insurance (PMI) cancel for homeowners?",Federal Mortgage-Related Laws,Other Federal Laws and Guidelines,12%,18%,22%,25%,2
"In a residential loan transaction, which of the following statements is true?",Mortgage Loan Origination Activities,Loan Inquiry and Application Process Requirements,The broker must verify whether the LE has been provided to the underwriter.,The lender must provide the LE to the borrowers.,The lender must verify the LE has been provided to the sellers.,The mortgage broker must provide the LE to the lender.,1
"A borrower's loan amount is $212,000 and his interest rate is 4.375%. What will the borrower's annual interest payment be?",Mortgage Loan Origination Activities,Financial Calculations,"$12,031 ","$19,265 ",$772.91 ,"$9,275 ",3
Which one of the following statements about closing agent fees is true?,Mortgage Loan Origination Activities,Closing,Closing agent fees are based on the property sale price.,Closing agent fees are standardized nationwide.,The borrower may be reimbursed for closing agent service fees in circumstances where the lender chooses the closing agent.,The closing agent organization may set fees based on annual averages based on geographical area.,2
"In an interest-only loan, what does the lump sum payment include?",General Mortgage Knowledge,Mortgage Loan Products,Interest and principal,Interest only,"Interest, principal, and taxes",Principal only,3
How often can consumers get a copy of their credit reports for no charge?,Federal Mortgage-Related Laws,Other Federal Laws and Guidelines,As often as the consumer wants,Every four months each credit reporting company sends a copy of the credit report,Never,Once a year from each credit reporting company,3
Which of the following allow the borrower to exercise the right of rescission?,Mortgage Loan Origination Activities,Closing,A borrower decided to refinance their home using the same lender. The loan will be for only a fraction of the existing mortgage balance.,A borrower who's refinancing his home using a new lender.,A buyer purchasing a condominium that will be used as their primary residence.,A state agency is offering a mortgage loan.,1
"When an individual renews his MLO license, what does he need to submit?",Uniform State Content,License Law and Regulation,Credit report,Fingerprints,National and state examination results,Renewal application and fee,3
Which one of the following is a true statement regarding licensee examinations and investigations?,Uniform State Content,Compliance,Examinations are always random and not scheduled in advance.,Examinations may be conducted of any licensee at any time.,"Investigations may only be conducted after receiving a formal, written complaint.",Licensees are not required to provide requested records until they are subpoenaed.,1
When must the Affiliated Business Arrangement (ABA) Disclosure form be provided to the borrower?,Mortgage Loan Origination Activities,Loan Inquiry and Application Process Requirements,At any time,At the time of or before the referral,Two weeks after the referral,Two weeks before closing,1
An example of a Loan Estimate zero-tolerance item for which fees may not increase before closing is ______.,Federal Mortgage-Related Laws,Truth in Lending Act (TILA),A loan application fee,Mortgage interest,Prepaid taxes,Recording fees,0
When is the final deadline for renewing licenses?,Uniform State Content,License Law and Regulation,December 31,January 1,June 30,November 1,0
"A loan originator in Utah is working with a consumer on a closed-end mortgage. When the loan closes, the originator is paid by both the consumer and the creditor. Under the loan origination rule, is this legal?",Uniform State Content,State Mortgage Regulatory Agencies,"If the consumer acknowledges their consent, then it's legal","No, originators may not receive dual compensation.",This is legal.,This may be legal depending on who the creditor is.,1
Which of these is excluded on a title insurance policy on Martha's property because of the schedule of exceptions?,Mortgage Loan Origination Activities,Qualification: Processing and Underwriting,A mechanic's lien recorded by A1 Siding and Windows,A verbal lease agreement Martha has with her neighbor who leases Martha's garage,Last year's unpaid property taxes,The current year's unpaid property taxes,1
"When providing a loan applicant with a Loan Estimate, what's the timeframe with which a lender must comply?",Federal Mortgage-Related Laws,Real Estate Settlement Procedures Act (RESPA),Three business days before loan consummation,Upon loan application approval,Upon loan application submission or within three business days,Upon seller acceptance of the buyer's purchase offer,2
"A seller has a closing date of October 11. He's already paid his annual taxes of $1,825. Assuming the buyer owns the day of closing and assuming a calendar year proration, which of the following statements is true regarding the property tax proration?",Mortgage Loan Origination Activities,Financial Calculations,"The seller will be credited $1,825 at closing.",The seller will be credited $410 at closing.,"The seller will be debited $1,415 at closing.",The seller will be debited $410 at closing.,1
Which one of the following loan types is NOT assumable?,Uniform State Content,Compliance,Conventional,FHA,USDA,VA,0
"An MLO has an established business relationship with a consumer who purchased a loan product and who's on the Do Not Call Registry. Related to solicitation calls, which of the following statements is true?",Ethics,Ethical Behavior Related to Loan Origination Activities,The consumer may be called for up to 18 months.,The consumer may be called for up to 90 days.,The consumer may be called without restriction.,The consumer may not be called.,0
"Melissa worked with Carter on his loan application. She told him that he should take the high-interest loan because no other lender would even offer him a loan, but she was able to because her loan guidelines were the most lenient available. Also, she told him he must decide immediately, or the loan offer would be rescinded. Is there an ethical issue here?",Ethics,Ethical Issues,"No, she must inform a borrower that loan offers are rescinded the same day.","No, she wouldn't tell him this information if it weren't true.","Yes, she should give him more time to decide so she can earn compensation.","Yes, she's using coercion to make him decide quickly.",3
What is the purpose of the Know Before You Owe special initiative?,Mortgage Loan Origination Activities,Qualification: Processing and Underwriting,To help consumers add additional closing costs to their loan.,"To help consumers understand what loan options are available and avoid large, costly surprises at closing.",To provide specific reasons and an ECOA notice to borrowers when their loan application is rejected.,To require creditors to provide consumers with timely notice of the loan decision.,1
"The day after receiving a Loan Estimate form, a borrower requests to use another service provider that charges a higher fee but is said to do a better job in the long run. What must the lender provide in response to the borrower's request?",Federal Mortgage-Related Laws,TILA-RESPA Integrated Disclosure Rule (TRID),A letter of acceptance or denial of the request,An update to the Closing Disclosure,A revised LE,Nothing,2
The ECOA requires lenders to make a mortgage loan determination based on ______.,Federal Mortgage-Related Laws,Equal Credit Opportunity Act (ECOA),The applicant's age,The applicant's credit rating,The applicant's income source,The applicant's marital status,1
Which of the following does NOT describe a nontraditional mortgage loan?,General Mortgage Knowledge,Qualified and Non-Qualified Mortgage Programs,A 10-year fixed-rate mortgage,A 20-year adjustable-rate mortgage,A 30-year fixed-rate mortgage,An interest-only mortgage,2
"Related to the licensing of MLO businesses and their employees, which of the following statements is true?",Federal Mortgage-Related Laws,Truth in Lending Act (TILA),Bona fide nonprofit organization employees must be licensed.,Depository institution employees must be licensed.,Every individual loan originator employee must be licensed.,Not every individual loan originator employee must be licensed.,3
Barney received his annual escrow analysis statement. He has an excess of $200 in his account. What will happen to the $200 in his account?,Mortgage Loan Origination Activities,Closing,He will be refunded the surplus of funds beyond what is needed to keep the account in good standing.,The balance is allocated to the escrow account manager for services rendered.,The balance remains in his account for the life of the loan.,The funds may only be used for future expenses.,0
