Question,Topic,Subtopic,Option 1,Option 2,Option 3,Option 4,Correct Answer
How do RESPA rules impact mortgage loan originators in relation to settlement services?,Federal Mortgage-Related Laws,Real Estate Settlement Procedures Act (RESPA),RESPA doesn't provide any information on settlement services that applies directly to MLOs.,RESPA prohibits MLOs from accepting kickbacks from any settlement service providers related to a mortgage loan transaction.,RESPA prohibits MLOs from performing any settlement services in connection with a mortgage loan transaction.,RESPA states that MLOs may compensate and be compensated in any way for settlement services rendered to a mortgage borrower.,1
Which one of the following is NOT considered to be a best practice when assisting with an examination?,Uniform State Content,Compliance,Displaying all loan originator licenses prominently,Introducing the examiner to all key personnel in the office,Making only the past year's mortgage-related records accessible to the examiner,Providing the examiner with a private workspace and a tour of the location,2
All of the following are stages of money laundering process except for which one?,Federal Mortgage-Related Laws,Other Federal Laws and Guidelines,Exchange,Integration,Layering,Placement,0
Fees related to third-party service providers and recording fees are subject to what tolerance threshold?,Mortgage Loan Origination Activities,Qualification: Processing and Underwriting,10% tolerance threshold,20% tolerance threshold,No tolerance threshold,Zero tolerance threshold,0
"A borrower just received a large bonus, which she plans to use for the down payment of her house. For how many days must the money be in her bank account for her to be able to use the funds?",Mortgage Loan Origination Activities,Qualification: Processing and Underwriting,120 days,30 days,60 days,90 days,2
"Juliette works at a credit card bank, where she assembles, administers, and processes loan application paperwork before it goes to an underwriter. Is her bank required to be licensed?",Uniform State Content,License Law and Regulation,"No, depository institutions such as credit card banks don't need to be licensed.","No, only trust companies must be licensed.","Yes, depository institutions such as credit card banks must be licensed.","Yes, the bank must be licensed if a consumer requests it.",0
Which one of the following is a true statement about FHA mortgage loans?,General Mortgage Knowledge,Terms Used in the Mortgage Industry,An FHA loan is best for borrowers who have large down payments.,An FHA loan is usually more attractive to borrowers with lower credit scores and down payments.,"FHA loans are available to all borrowers, regardless of credit history.",FHA loans have more stringent requirements than conventional loans.,1
"Which of the following may offer identity theft red flags through alerts, notifications, or warnings?",Ethics,Ethical Issues,A bank,A consumer advocacy group,A consumer reporting agency,A lender,2
"As with VA loans, USDA loans ______.",General Mortgage Knowledge,Qualified and Non-Qualified Mortgage Programs,Are guaranteed by the government,Don't require mortgage insurance,Have a funding fee of 2.15%,Have no underwriting standards,0
What is the minimum number of counseling agencies that the Homeownership Counseling Disclosure must provide to a consumer?,Mortgage Loan Origination Activities,Loan Inquiry and Application Process Requirements,10 counselors,15 counselors,20 counselors,Five counselors,0
"Related to giving borrowers advice, what rule would a wise and ethical MLO follow?",Ethics,Ethical Behavior Related to Loan Origination Activities,Give advice only when asked a specific question.,"Give advice, whether it's solicited or not.","Give no one any advice, ever.",Give solicited advice within the MLO's scope of expertise.,3
When must a creditor provide notice to consumers if their loan is accepted?,Mortgage Loan Origination Activities,Loan Inquiry and Application Process Requirements,15 days,20 days,25 days,30 days,3
What is the primary purpose of the Bank Secrecy Act?,Federal Mortgage-Related Laws,Other Federal Laws and Guidelines,To maintain confidentiality for all financial customers' private data,"To prohibit banks, lenders, and financial institutions from collaborating to fix prices",To protect consumers from misrepresentation and illegal marketing schemes,To require financial institutions to monitor transactions and keep records of suspicious activities,3
What does the CFPB's loan originator rule do?,Uniform State Content,State Mortgage Regulatory Agencies,It determines the maximum amount that loan originators may make in one year.,It regulates how compensation is handled in an assumable loan.,It regulates how compensation is paid to a loan originator in most closed-end mortgage transactions.,It regulates how compensation is paid to a loan originator in most open-end mortgage transactions.,2
"An MLO provides disparate treatment to two white Christian male loan applicants. The only noticeable difference between them is that one was born in the United States and the other wasn't. Is this illegal? If so, which protected class is involved?",Federal Mortgage-Related Laws,Other Federal Laws and Guidelines,No. Fair housing laws are designed to protect visible minorities only.,Yes. This is discrimination on the basis of national origin.,Yes. This is discrimination on the basis of religion.,Yes. This is discrimination on the basis of sex.,1
Which of these best describes a property in a special flood hazard area?,Mortgage Loan Origination Activities,Qualification: Processing and Underwriting,A house with a basement,A neighborhood in which 80% of the properties are sloped,Any area where flood insurance is mandatory,A property with a creek that's flooded in the last two years,2
A credit applicant exercised his right to apply for financing under the regular terms of federal consumer protection laws and was subsequently denied credit for a discriminatory reason. Which law does this violate?,Federal Mortgage-Related Laws,Equal Credit Opportunity Act (ECOA),Consumer Protection Act,Equal Credit Opportunity Act,Fair Housing Act,Gramm-Leach Bliley Act,1
The upfront mortgage insurance premium (MIP) on an FHA loan is calculated based on ______.,General Mortgage Knowledge,Terms Used in the Mortgage Industry,The base loan amount,The base loan amount divided by 12,The property's appraised price,The property's purchase price,0
"If a lender requires a borrower to put at least 20% down on a $563,000, how much must the borrower pay?",Mortgage Loan Origination Activities,Financial Calculations,"$11,260 ","$112,600 ","$19,705 ","$84,450 ",1
A consumer receives an adverse action notice from her lender. Which of the following may have occurred?,Federal Mortgage-Related Laws,Equal Credit Opportunity Act (ECOA),The consumer's account was terminated.,The consumer's application for credit was approved.,The consumer's application was complete.,The lender made a favorable change to the consumer's account.,0
"Bart is exploring the best offerings to fund his mortgage when he's financing $200,000. He's trying to calculate the best loan origination fees. Which of the following is the best rate offering?",Mortgage Loan Origination Activities,Closing,1% of loan amount,.5% plus two mortgage points,"Flat fee of $1,000 plus one half a mortgage point","Flat fee of $1,300",3
The Federal Housing Administration (FHA) adjusts loan limits for each county ______.,General Mortgage Knowledge,Terms Used in the Mortgage Industry,Annually,Every five years,Every three years,Monthly,0
"When someone agrees to become a loan originator, what action do they agree to?",Uniform State Content,Compliance,"To behave in a manner that is lawful, honest, and fair.",To omit debt not on a credit report.,To pay for a real estate agent's ads.,To use a supervisor's NMLS UI.,0
"In the Liability After Foreclosure section of the CD, the box next to the statement that state law might offer protection should NOT be checked if which of the following protections is the only protection available?",Federal Mortgage-Related Laws,Truth in Lending Act (TILA),A prohibition in state law against the dual tracking of foreclosures,A requirement that servicers assign borrowers a single point of contact,A statute of limitations on when a creditor can seek redress,The ability to sue for violations of a state homeowner bill of rights,2
Marcus is a loan originator whose company is a federal depository and manages the assets of others and is responsible for transferring assets to beneficiaries. Does he need to be licensed as an MLO?,Uniform State Content,License Law and Regulation,"Maybe, depending on his role in the company","Maybe, depending on whether the CFPB approved him","No, he must be registered through the NMLS","Yes, he must be licensed through the NMLS",2
A consumer refuses to provide a financial institution with HMDA data. What's the best course of action for the financial institution in this case?,Federal Mortgage-Related Laws,Other Federal Laws and Guidelines,The consumer should be reported for failure to comply with HMDA.,The financial institution should do nothing.,The financial institution should provide HMDA data based on visual observations and the consumer's surname.,The financial institution should refuse to provide the loan to the consumer.,2
Which of the following is a changed circumstance for which the Loan Estimate may be revised?,Ethics,Ethical Behavior Related to Loan Origination Activities,A fluctuating interest rate impacts charges.,Charges were underestimated.,Computer issues caused an error.,One of the fees was miscalculated.,0
What is the purpose of the Fair Credit Reporting Act?,Federal Mortgage-Related Laws,Other Federal Laws and Guidelines,It controls the types of loans that creditors may offer to the public.,It prevents lenders from discriminating against loan applicants based on protected classes.,It regulates how lenders may use consumers' credit report data.,It requires lenders to disclose information regarding the terms and conditions of a loan before an application is submitted.,2
"Jacob and his spouse, Marty, both sign mortgage documents at closing. Based on this, Marty _____.",Mortgage Loan Origination Activities,Closing,Doesn't have a credit commitment,Has no ownership rights to the property,Is a legal party to the loan,Is the sole applicant,2
Your borrower's preliminary title commitment report details requirements that must be satisfied. Does this affect when the final title insurance policy will be issued?,Mortgage Loan Origination Activities,Qualification: Processing and Underwriting,"No. A final title policy will be issued after the final settlement, and it will list the exceptions to be cleared, as well as the timeframe during which they must be cleared.",No. Any requirements detailed in the preliminary title commitment can be cleared after the final settlement.,"Yes. The final title insurance policy is issued only after the final settlement on the property has occurred, and the specific conditions named in the preliminary title report have been satisfied.",Yes. The final title insurance policy will be issued after the final settlement if the lender provides exceptions to the specific conditions named in the preliminary title report.,2
What entity is responsible for enforcing the Equal Credit Opportunity Act?,Federal Mortgage-Related Laws,Equal Credit Opportunity Act (ECOA),Civil Rights Commission,Consumer Financial Protection Bureau,Department of Justice,FDIC,1
Which of the following is a hallmark of the language used in the Loan Estimate?,Federal Mortgage-Related Laws,Truth in Lending Act (TILA),Language understood by MLOs,Legal terms and acronyms,Plain language,Technical financial terminology,2
"When an examiner is investigating a licensee's books and records, what sort of items are being investigated?",Uniform State Content,Compliance,College credits,High school transcripts,Marriage licenses,MLO's personal experience and history,3
"If the borrower selects the closing agent who's not listed on the creditor's written list of providers, which one of the following statements is true?",Mortgage Loan Origination Activities,Closing,The borrower must pay the closing agent fees and related charges at closing.,The closing agent fees are incorporated into the loan.,The lender must pay the closing agent fees and related charges at closing.,The seller must pay the closing agent fees and related charges at closing.,0
The CSBS and AARMR have said that all of these are ways for lenders to mitigate the risks associated with nontraditional mortgage products EXCEPT:,General Mortgage Knowledge,Terms Used in the Mortgage Industry,"Expand underwriting guidelines to be more stringent, and manage loan terms.",Implement risk management practices and control systems.,Provide consumer communication and education opportunities.,Stop offering nontraditional mortgage products and loan features.,3
What does the Equal Credit Opportunity Act (ECOA) mandate regarding mortgage applications in Maryland?,Uniform State Content,SAFE Act,Lenders must disclose the applicant's credit score with the loan approval notice.,"Lenders must evaluate applications regardless of race, color, religion, sex, or national origin.",Lenders must offer a grace period for payment if the application is denied.,Lenders must provide borrowers with a written credit history summary.,1
Which one of the following statements is true?,Uniform State Content,Compliance,"States do not have the right to examine MLOs' documentation, nor do they have the authority to interview employees.","States have the right to examine MLOs' documentation, and also have the authority to interview employees.",States only have the authority to interview employees but do not have the right to examine MLOs' documentation.,States only have the right to examine MLOs' documentation. They do not have the authority to interview employees.,1
Which category of real estate transactions is covered under the federal Fair Housing Act's anti-discrimination provisions?,Ethics,Ethical Issues,Commercial property rentals,Commercial property sales,Residential or commercial property financing,Residential property financing,3
All of the following are recommended responses to FTC red flags except for which one?,Federal Mortgage-Related Laws,Other Federal Laws and Guidelines,Close the account.,Contact the customer.,Ignore the red flag.,Notify law enforcement.,2
"A couple applies for an FHA loan in order to buy a $210,000 house. What is the minimum down payment that the couple must be prepared to pay in order to qualify for the loan?",Mortgage Loan Origination Activities,Financial Calculations,$0 ,"$42,000 ","$6,300 ","$7,350 ",3
An MLO is working with the Smiths on completing a loan application. How many days from the date their application is submitted does the MLO have to provide the Right to Receive Appraisal form?,Mortgage Loan Origination Activities,Qualification: Processing and Underwriting,15 days,Five days,Seven days,Three days,3
One important task performed by the Consumer Financial Protection Bureau includes _____.,Federal Mortgage-Related Laws,Regulatory Authority,Assisting real estate agents with commercial transactions,Breaking up monopolies and oligopolies,Lobbying on behalf of financial institutions,Supervising financial institutions,3
"Your borrower has applied for four different department store credit cards and bought furniture on a 90-day same-as-cash plan, all within the last 60 days. How will this impact his credit score?",Mortgage Loan Origination Activities,Qualification: Processing and Underwriting,It won't affect his credit score.,The additional accounts will have a positive impact on his score.,The additional open credit will increase his score.,The high number of new accounts and inquiries will have a negative impact on his score.,3
Which one of the following is NOT classified as a loan origination fee?,Mortgage Loan Origination Activities,Closing,Application fee,Loan funding fee,Title search fee,Underwriting fee,2
Which of the following disclosure forms provides buyers with approximate costs they might encounter at closing?,Federal Mortgage-Related Laws,Truth in Lending Act (TILA),Closing Disclosure form,Loan Estimate form,Service Shopping Disclosure form,Servicing Transfer Disclosure form,1
A borrower isn't sure when she's supposed to receive a Closing Disclosure (CD). Which one of the following is a true statement regarding this deadline?,Federal Mortgage-Related Laws,TILA-RESPA Integrated Disclosure Rule (TRID),She'll receive the CD shortly after the closing date.,She will get the CD before she signs the loan contract.,She will get the CD once the purchase agreement with the seller is executed.,She won't receive the CD until after she pays all of her closing costs.,1
"Damian is charging two of his clients, Elise and Ferdie, for the same settlement service based on an average charge. However, the amount Damian charges Elise is greater than the amount he charges Ferdie. Why is this a problem?",Federal Mortgage-Related Laws,Truth in Lending Act (TILA),Damian must charge Elise and Ferdie the same amount whether he uses an average charge or the actual charge.,Damian must use the same average charge for every transaction within a defined class.,Elise and Ferdie must first both agree to Damian's use of this method for calculating charges.,There's no problem here. Damian can charge his clients what he likes.,1
Which of the following is a MLO inappropriate response to identity theft suspicious activity and red flags?,Ethics,Ethical Issues,Downgrade the risk to “non-concern status” immediately because the red flag itself prevents identity theft.,Notify the borrower to change the covered account's access codes or passwords.,Obtain additional documentation and as much information as possible to verify application information.,Report the red flag to law enforcement.,0
The Dodd-Frank Act accomplishes which of the following?,Federal Mortgage-Related Laws,Regulatory Authority,Created the CFPB to oversee the financial industry.,Removed appraisals from FIRREA oversight.,Struck down the Home Valuation Code of Conduct (HVCC).,Wrote and published the Uniform Standards of Professional Appraisal Practice (USPAP).,0
Telemarketers are legally required to check the ____ every 31 days.,Federal Mortgage-Related Laws,Other Federal Laws and Guidelines,FBI International Terrorist List,FCC Telemarketing Block List,FTC Customer Request Registry,National Do Not Call Registry,3
A prospective borrower applied for an FHA-insured loan. The lender determined that the borrower may qualify for a similar conventional mortgage loan product. What must the lender do?,Federal Mortgage-Related Laws,Other Federal Laws and Guidelines,The lender must alert the applicant that he qualifies for an Informed Consumer Choice Disclosure Notice and may request one within 30 days of application submission.,The lender must provide an Informed Consumer Choice Disclosure Notice to alert the applicant that he doesn't qualify for the FHA loan.,The lender must provide an Informed Consumer Choice Disclosure Notice to alert the applicant that he must also apply for a conventional loan.,The lender must provide an Informed Consumer Choice Disclosure Notice to the applicant within three business days of receiving the loan application.,3
"A borrower's annual property tax bill is $1,450 and she pays $75 a month for insurance. If her principal and interest payments are $21,800 for the year, what is her total monthly mortgage payment?",Mortgage Loan Origination Activities,Financial Calculations,"$2,012.50 ","$2,350.30 ","$24,150 ",$900 ,0
What type of title insurance policies are needed during a real estate transaction?,Mortgage Loan Origination Activities,Qualification: Processing and Underwriting,Buyer's and seller's policies,Home and flood insurance policies,Lender's and seller's policies,Owner's and lender's policies,3
Applicant Misha contacted MLO Marcus to apply for a loan in a program for first-time homebuyers. Misha said she had gotten one of those loans before. What should Marcus do?,Ethics,Ethical Behavior Related to Loan Origination Activities,Explain to Misha that the lender will deny her loan application.,Hang up on Misha because she sounds mentally unstable.,Take Misha's application for a first-time homebuyer's loan.,"Tell Misha she doesn't qualify for the loan, so he can't take her application.",2
Which of the following is something a lender is prohibited from doing if it wants to give a borrower a qualified mortgage loan?,General Mortgage Knowledge,Terms Used in the Mortgage Industry,Allow debt-to-income ratios of less than 43%.,Amortize the loan.,Include a balloon payment.,Institute payback terms of less than 30 years.,2
When does the title insurance company issue the title insurance policy?,Mortgage Loan Origination Activities,Qualification: Processing and Underwriting,After the borrower's attorney has reviewed and approved the title commitment,"At closing, after all the pertinent documents have been signed, and the seller has handed over the keys to the borrower",At the same time the title commitment is issued,"Once the requirements have been satisfied, and the seller has delivered the deed to the borrower",3
"HPML lenders are required under the TILA HPML escrow rule to establish and maintain an escrow account for the payment of property taxes and premiums for mortgage-related insurance required by the creditor for at least ______ years, regardless of the LTV ratio.",General Mortgage Knowledge,Terms Used in the Mortgage Industry,10,Five,Seven,Three,1
Which of the following tasks may a servicer NOT charge for when working with an escrow account?,Mortgage Loan Origination Activities,Closing,Choosing to not have an escrow account by the borrower,Maintaining an escrow account over the life of the loan,Opening an escrow account,Sending regular reports to borrower for escrow status,3
Which one of the following parties is responsible for paying title insurance at closing?,Mortgage Loan Origination Activities,Closing,The borrower,The lender,The real estate agent,The seller,0
"The amount of the ______ a veteran must pay depends on various factors, such as military status, down payment amount, and whether the veteran's entitlement is being used for the first time or a subsequent time.",Mortgage Loan Origination Activities,Qualification: Processing and Underwriting,Entitlement fee,Funding fee,Guarantee fee,Mortgage insurance premium,1
Fred calls an individual a month after he was told by the individual to not call her about refinancing. How would the TSR define Fred's conduct?,Ethics,Ethical Issues,Abusive,Deceptive,Forgetful,Rude,0
Which of the following is NOT an MLO-provided service?,Uniform State Content,License Law and Regulation,Collecting an applicant's credit and financial information,Guiding applicants through the process approval,Making the final decision on approving the loan,Preparing the loan application,2
UIs must be displayed on which of the following?,Uniform State Content,Compliance,All correspondence between loan originators and lenders,All loan applications and marketing materials,On any advertisement or document that contains the NMLS logo,Only on paper-based advertising (not websites and electronic media),1
"Carlita is applying for a mortgage loan and she sees a section on her application asking questions regarding her race, ethnicity, and sex. Is this a violation of fair housing laws?",Federal Mortgage-Related Laws,Other Federal Laws and Guidelines,"No, it's a requirement of the Home Mortgage Disclosure Act.","No, it's a violation of the Equal Credit Opportunity Act.","No, it's a violation of the Home Mortgage Disclosure Act.","Yes, it's a violation.",0
"A borrower has a loan-to-value ratio of 80% after purchasing a property for $400,000. How much is the buyer financing?",Mortgage Loan Origination Activities,Qualification: Processing and Underwriting,"$320,000 ","$350,000 ","$360,000 ","$80,000 ",0
Which of these items is commonly used for employment verification?,Mortgage Loan Origination Activities,Qualification: Processing and Underwriting,A gift letter,Employment verification,Two months of bank statements,Two months of investment statements,1
A lender has 90 days to provide a consumer with notice _____.,Federal Mortgage-Related Laws,Equal Credit Opportunity Act (ECOA),That a credit application has been denied,That adverse action was taken on an existing account,That adverse action was taken on an incomplete application,That the lender is extending a counter-offer,3
Gift funds from an acceptable donor can be used for all of the following costs or property types EXCEPT for which one?,Mortgage Loan Origination Activities,Loan Inquiry and Application Process Requirements,Closing costs,Down payment,Financial reserves,Investment properties,3
Which of the following must be licensed or registered to take residential mortgage loan applications and negotiate the loan terms?,Uniform State Content,License Law and Regulation,Clerical staff,Loan processors,MLOs,Underwriters,2
Which one of the following is part of the title insurance fees a borrower can expect to pay at closing?,Mortgage Loan Origination Activities,Closing,Appraisal,Loan origination,Survey,Title search,3
To whom must an Informed Consumer Choice Disclosure Notice be provided?,Federal Mortgage-Related Laws,Other Federal Laws and Guidelines,All applicants for a conventional mortgage loan product,All mortgage loan applicants,Any applicant for an FHA-insured mortgage loan product,Any applicant who may qualify for an FHA-insured or another loan product,3
